{
  "schema_version": "starter-bootstrap-0.2",
  "status": "READY",
  "product_or_workstream": "SYNTHETIC_STATEFUL_BACKEND",
  "observed_code_ref": "reference/stateful-v1",
  "observed_at": "2030-04-01T12:00:00Z",
  "role": "I2_PROJECT_WORKSTREAM_PLANNER",
  "kernel_version": "agentic-sdlc-reference-v0.7",
  "requirements_ref": "state/CLIENT_REQUIREMENTS_CURRENT.md",
  "product_state_ref": "state/PRODUCT_STATE_CURRENT.json",
  "active_campaign_ref": null,
  "active_checkpoint_or_terminal_ref": null,
  "current_gate": "REFERENCE_VALIDATED",
  "strongest_evidence_refs": [
    "../evidence/STATEFUL_REFERENCE_EVIDENCE.json"
  ],
  "next_legal_boundary": "Use this system as a stateful transfer/adoption fixture; open a new strategic campaign only for a new capability.",
  "forbidden_actions": [
    "Invent an active campaign.",
    "Treat reference validation as production release authority."
  ],
  "currentness": {
    "verified": true,
    "verified_at": "2030-04-01T12:00:00Z",
    "source_refs": [
      "state/CLIENT_REQUIREMENTS_CURRENT.md",
      "state/PRODUCT_STATE_CURRENT.json",
      "state/OWNER_REGISTRY_CURRENT.json",
      "governance/PROJECT_OVERLAY.md",
      "../evidence/STATEFUL_REFERENCE_EVIDENCE.json"
    ],
    "unresolved": [],
    "source_bindings": [
      {
        "ref": "../app/note_store.py",
        "sha256": "b6f5606d19a48e136f09f31d03ec32b91492a3771c557509adf9aa77882418a9"
      },
      {
        "ref": "../evidence/STATEFUL_REFERENCE_EVIDENCE.json",
        "sha256": "ba2bcf48779616d0019a4acda6ceac26b2ac9866a63ca63cf9cc7ded8a643def"
      }
    ],
    "artifact_bindings": []
  }
}
